handle,category,source,note
emilylehrer,biotech,academic,MIT Media Lab researcher
drewendy,biotech,academic,Stanford bioengineering professor
patrickhsu,biotech,academic,UC Berkeley CRISPR researcher
jenniferdoudna,biotech,academic,UC Berkeley Nobel laureate
fengzhang,biotech,academic,Broad Institute CRISPR pioneer
davidliu,biotech,academic,Harvard chemical biology professor
georgechurch,biotech,academic,Harvard geneticist
eriksontheimer,biotech,academic,UMass RNA researcher
pamelasilver,biotech,academic,Harvard systems biology professor